{
  "provider_id": "fixture://fixture-instance-1",
  "addresses": [
    {
      "type": "InternalIP",
      "address": "10.0.0.10"
    },
    {
      "type": "Hostname",
      "address": "fixture-instance-1"
    }
  ],
  "failure_domain": null,
  "interruptible": false,
  "health": {
    "state": "running",
    "healthy": true,
    "message": null,
    "reasons": []
  }
}
